[
  {
    "alias": "synthetic-auditor-a",
    "status": "available",
    "capabilities": ["audit", "python"],
    "cost_rank": 1,
    "priority": 10
  },
  {
    "alias": "synthetic-auditor-b",
    "status": "available",
    "capabilities": ["audit", "python", "docs"],
    "cost_rank": 2,
    "priority": 5
  }
]
